language,dialect,accent,source,original_text,standard_persian_translation,english_translation
Unclassified,Dezfuli,Dezfuli,https://pegah1377.blogfa.com/post/22,غلوم پِ اُرِ سیَه اومَّه دخترَ برد قصر شاه پریون.,غلام با ابر سیاه آمد و دختر را به قصر شاه پریان برد.,The slave came with a black cloud and took the girl to the palace of the fairies.
Unclassified,Dezfuli,Dezfuli,https://hastii2.blogfa.com/post/556,ای وب چَنی قشنگَه,این وب چقدر قشنگه.,This web is so beautiful.
Unclassified,Dezfuli,Dezfuli,https://chamadaneabi.ir/kalamat-dezfuli/,مَخوم یَقه‌مَه دِروم,می‌خواهم یقه‌ام را پاره کنم (از استیصال/عصبانیت),I want to tear my collar (from despair/anger)
Unclassified,Dezfuli,Dezfuli,Manual,تَش به كارِت , گند بخوره به کارت.,May your work be ruined.
Unclassified,Dezfuli,Dezfuli,Manual,هر چه مارِش دوُنا بيد خودش مَرِسی زِيَس , برعکس مادرش که عاقل بود خودش انگار دیونس.,"Unlike her mother, who was sensible, she seems to be a fool."
